Product Category,Tags,Title,Handle,Body (HTML),Variant Price,Length,Width,Width Unit,Thickness,Variant Weight,Variant Weight Unit,Image Src
Building Materials,"""Roofing,Roof Panels,Metal Roofing""",8 ft. Corrugated Galvanized Steel 31-Gauge Roof Panel,8-ft-corrugated-galvanized-steel-31-gauge-roof-panel,"Gibraltar's galvanized steel corrugated panels are trusted by professionals and homeowners for a variety of applications. This 31-Gauge corrugated galvanized steel panel is a thin utility use panel that's durable for roofing and siding and is also recommended for DIY projects, privacy fencing, planters and garden sheds. Other uses include: back splashes, ceilings, wainscoting and craft projects. The distinctive galvanized finish will stand up to all kinds of weather and can be painted or aged for a variety of interesting visual effects. Corrugated panels are easily cut with shears and being light weight makes them easy to use and transport.<div class=""grid bullet-list-wrapper""><ul class=""bullet-list bullet-list--margin list list--type-square""><li class=""list__item""><span>Thin and light weight for ease of use or transport; cuts easily with common aviation snips</span></li><li class=""list__item""><span>31-Gauge thickness, recommended for roof slopes of 3/12 pitch or greater</span></li><li class=""list__item""><span>Corrugated panels will not rot, mildew or warp and can form an effective pesticide-free barrier against termites and other insects</span></li><li class=""list__item""><span>Non-combustible; resistance to fire increases your security and may result in lower insurance premiums</span></li><li class=""list__item""><span>Corrugated panels are a good choice for the environment; after a long service life corrugated panels are still 100% recyclable</span></li><li class=""list__item""><span>21-1/2 in. roof coverage or 24 in. siding coverage</span></li><li class=""list__item""><span>Galvanized steel is a low-maintenance product that is known for durability</span></li><li class=""list__item""><span>Panel is unpainted</span></li><span class=""list__item list__item--nopadding"" data-testid=""list-item-no-padding""></span><li class=""list__item""><a href=""https://www.homedepot.com/c/Return_Policy"" target=""_blank"" rel=""noopener noreferrer"" class=""product-overview__return-link"">Return Policy</a></li><li class=""list__item""><div class=""prop65-wrapper""><div class=""prop65-wrapper--flex""><div>California residents</div><div aria-expanded=""false""><button class=""list__link bttn-outline bttn--link"" id=""prop65__tooltip""><span class=""bttn__content"">see Prop 65 WARNINGS</span></button></div></div></div></li></ul></div>",18.48,96,25.75,in,0.01,7.37,lb,https://images.thdstatic.com/productImages/e6c67ca2-8514-4deb-80e9-22055869e93b/svn/metal-roofing-13513-64_600.jpg
Building Materials,"""Moulding & Millwork,Moulding,Door & Window Moulding,Casing""",Pro Pack 356 11/16 in. x 2 1/4 in. x 84 in. Primed Finger Jointed Casing (5-Pack − 35 Total Linear Feet),pro-pack-356-1116-in-x-2-14-in-x-84-in-primed-finger-jointed-casing-(5-pack-35-total-linear-feet),"Looking to add the perfect finishing touch to windows and doors. The Woodgrain Millwork 11/16 in x 2-1/4 in WM356 Primed Finger Jointed Pine Casing Door Pack includes five 84 inch sides which is enough material to finish both sides of a door. Casing is used around doors and windows to cover the gaps between the frames and walls. Combine the casing with a backband to create a bold, one-of-a-kind-look.<div class=""grid bullet-list-wrapper""><ul class=""bullet-list bullet-list--margin list list--type-square""><li class=""list__item""><span>Smooth, consistent surface is free from knots and is ready to finish</span></li><li class=""list__item""><span>Can be painted with any high quality, latex-based paint</span></li><li class=""list__item""><span>A traditional pattern that creates a classic style for your doors and windows</span></li><li class=""list__item""><span>Installs with common woodworking tools</span></li><li class=""list__item""><span>Contains five pieces at 84 in.</span></li><li class=""list__item""><span>Note: product may vary by store</span></li><li class=""list__item""><span><a href=""https://www.homedepot.com/services/c/door-window-specialist/893e44520"" target=""_blank"" style=""color:#F96302;"">Speak to an Associate about Doors and Windows. Call 1-833-HDAPRON (432-7766) for free design, purchase and installation help daily from 9AM - 9PM EST.</a></span></li><li class=""list__item""><a href=""https://www.homedepot.com/c/Return_Policy"" target=""_blank"" rel=""noopener noreferrer"" class=""product-overview__return-link"">Return Policy</a></li><li class=""list__item""><div class=""prop65-wrapper""><div class=""prop65-wrapper--flex""><div>California residents</div><div aria-expanded=""false""><button class=""list__link bttn-outline bttn--link"" id=""prop65__tooltip""><span class=""bttn__content"">see Prop 65 WARNINGS</span></button></div></div></div></li></ul></div>",45.88,84,2.25,in,undefined,undefined,undefined,https://images.thdstatic.com/productImages/c516babc-6bb5-41ea-a2f4-827edc7d8744/svn/white-woodgrain-millwork-casing-108378-64_600.jpg
Building Materials,"""Drywall,Joint Compound""",18 lb. Easy Sand 20 Lightweight Setting-Type Joint Compound,18-lb-easy-sand-20-lightweight-setting-type-joint-compound,"USG Sheetrock Brand Easy Sand 20 Joint Compound is a lightweight, setting-type compound with a 20-minute working time. USG setting-type joint compounds provide faster finishing of drywall interiors, even under slow drying conditions. Rapid chemical hardening and low shrinkage permit same-day finishing and usually next-day decoration. USG Sheetrock Brand Easy Sand 20 Joint Compound features an exceptional bond; virtually unaffected by humidity extremes. It is ideal for laminating double-layer systems, particularly fire-rated assemblies, and for adhering gypsum panels to above-grade concrete surfaces. May also be used for surface texturing and for filling, smoothing and finishing interior above-grade concrete. Note:  Setting-type joint compounds should not be used for skim coating due to dryout concerns.<div class=""grid bullet-list-wrapper""><ul class=""bullet-list bullet-list--margin list list--type-square""><li class=""list__item""><span>Weigh up to 25% less than conventional weight setting-type joint compounds</span></li><li class=""list__item""><span>Sands easily; similar to a ready-mixed, all-purpose joint compound</span></li><li class=""list__item""><span>Unique humidity resistance</span></li><li class=""list__item""><span>Check-crack resistance in heavy ﬁlls</span></li><li class=""list__item""><span>For interior gypsum panels and exterior gypsum ceiling boards</span></li><li class=""list__item""><span>GREENGUARD Gold certified for low-emitting performance</span></li><li class=""list__item""><a href=""https://www.homedepot.com/c/Return_Policy"" target=""_blank"" rel=""noopener noreferrer"" class=""product-overview__return-link"">Return Policy</a></li></ul></div>",14.98,undefined,10,in,undefined,18,lb,https://images.thdstatic.com/productImages/acdf609a-8cea-4ed1-a796-554b92d2b100/svn/usg-sheetrock-brand-joint-compound-384214-64_600.jpg
Building Materials,"""Drywall,Drywall Sheets""",5/8 in. x 4 ft. x 8 ft. Mold Tough Firecode X Drywall,58-in-x-4-ft-x-8-ft-mold-tough-firecode-x-drywall,"USG Sheetrock Brand Mold Tough Panels Firecode X offer fire-, moisture- and mold-resistance for interior wall and ceiling applications. They are Type X panels that feature a noncombustible, moisture-resistant gypsum core encased in moisture-and mold-resistant, 100% recycled, green face and brown back papers. Long edges of the panels are tapered for easy finishing, allowing joints to be reinforced and concealed with Sheetrock Brand joint treatment systems. UL Classified for fire resistance, they can be used in any UL Design in which Type SCX panels are listed. The UL Type Designation is printed on the face along the long edge of each panel for easy identification by building inspectors.<div class=""grid bullet-list-wrapper""><ul class=""bullet-list bullet-list--margin list list--type-square""><li class=""list__item""><span>Scores and snaps easily; quick installation and decoration</span></li><li class=""list__item""><span>Intended for commercial or residential applications where 5/8 in. moisture- and mold-resistant Type X panels are required, including load-bearing and nonload-bearing wood- or steel-framed fire-rated walls; repair and remodel construction</span></li><li class=""list__item""><span>Comply with ASTM C1396, Standard Specification for Gypsum Board</span></li><li class=""list__item""><span>UL Classification as to fire resistance, surface-burning characteristics and noncombustibility</span></li><li class=""list__item""><span>GREENGUARD Gold certified for low-emitting performance</span></li><li class=""list__item""><a href=""https://www.homedepot.com/c/Return_Policy"" target=""_blank"" rel=""noopener noreferrer"" class=""product-overview__return-link"">Return Policy</a></li></ul></div>",21.48,8,4,ft,undefined,76.8,lb,https://images.thdstatic.com/productImages/333170cd-5f3f-4dda-a229-47b8bbde8ceb/svn/usg-sheetrock-brand-drywall-sheets-14313211308-64_600.jpg
Building Materials,"""Insulation,Foam Board Insulation""",FOAMULAR 150 1 in. x 4 ft. x 8 ft. R-5 Scored Square Edge Rigid Foam Board Insulation Sheathing,foamular-150-1-in-x-4-ft-x-8-ft-r-5-scored-square-edge-rigid-foam-board-insulation-sheathing,"FOAMULAR Extruded Polystyrene (XPS) Rigid Foam Insulation offers a comprehensive product line of insulation boards in a wide choice of sizes, thicknesses and edges with a Lifetime Limited Warranty for the life of the home or building. Foam insulation boards are easy to handle, score, cut and install &amp; no special tools are needed. Rigid foam insulation products can be used on wood, steel framing or concrete walls. FOAMULAR XPS resists moisture and retains R-value even after exposure to standing water and wet soil. Only XPS foam to be GREENGUARD Gold Certified and the first XPS foam certified by Scientific Certification Systems (SCS) to contain a minimum of 20% recycled content.<div class=""grid bullet-list-wrapper""><ul class=""bullet-list bullet-list--margin list list--type-square""><li class=""list__item""><span>Closed cell, highly moisture-resistant rigid foam board</span></li><li class=""list__item""><span>Lifetime limited warranty</span></li><li class=""list__item""><span>Insulation foam boards available in a wide choice of sizes, thicknesses and edges</span></li><li class=""list__item""><span>Retains R-value even after exposure to moisture and freeze thaw cycling</span></li><li class=""list__item""><span>Click here to shop <a href=""https://www.homedepot.com/p/Loctite-PL-300-10-fl-oz-Foamboard-Adhesive-1421941/202020476"" target=""_blank"" style=""color:#F96302;"">Loctite foamboard adhesive</a></span></li><li class=""list__item""><span>FOAMULAR 150 and 250 are available in various thicknesses and R-values, the difference is the compressive strength. FOAMULAR 150 has a compressive strength of 15 psi and FOAMULAR 250 is 25 psi</span></li><li class=""list__item""><span>FOAMULAR is not rated for STC (sound transmission) and does not have any soundproofing properties. <a href=""https://www.homedepot.com/b/Building-Materials-Insulation-Fiberglass-Insulation/Owens-Corning/N-5yc1vZbay7Z3q5"" target=""_blank"" style=""color:#F96302;"">Owens Corning fiberglass batts and rolls</a> are great options for acoustic applications.</span></li><li class=""list__item""><span>When using FOAMULAR or any low perm insulation, always verify the moisture vapor flow and dew point characteristics of the wall system. Please check your local building codes for vapor retarder/barrier information.</span></li><li class=""list__item""><span>If being used in an interior construction application, painting the FOAMULAR is not recommended as FOAMULAR cannot be left exposed and will need to be covered by a 15 minute thermal barrier such as drywall.</span></li><li class=""list__item""><span>If being used for crafts, acrylic or latex based paints can be used with FOAMULAR products.</span></li><li class=""list__item""><span>If you're looking to insulate your garage door, <a href=""https://www.homedepot.com/p/Owens-Corning-Garage-Door-Fiberglass-Insulation-Kit-22-in-x-54-in-8-Panels-GD01/202257272"" target=""_blank"" style=""color:#F96302;"">Owens Corning Garage Door Insulation Kit</a> is an easy, fast and affordable way to keep your garage warm in winter and cool in the summer.</span></li><li class=""list__item""><span>If you're looking to ventilate your attic rafters, <a href=""https://www.homedepot.com/p/Owens-Corning-Raft-R-Mate-22-1-2-in-x-4-ft-Attic-Insulation-Rafter-Baffle-Proper-Vents-70-Pieces-70RM/204853491"" target=""_blank"" style=""color:#F96302;"">Owens Corning Raft-R-Mate</a> is a XPS foam vent designed to assure unrestricted airflow from the soffit to the ridge vent.</span></li><li class=""list__item""><span>FOAMULAR is available in two edge configurations:</span></li><li class=""list__item""><span>Square Edge - designed to fit flush next to adjoining boards</span></li><li class=""list__item""><span>Scored Square Edge - comes with 3 factory scores, so that you can take a 4' sheet, break it in two and have two, 2' wide sheets (middle score), or you can break it into three 16"" wide pieces by snapping at the left and right score.</span></li><li class=""list__item""><span>Click here to shop <a href=""https://www.homedepot.com/b/Building-Materials-Insulation-Foam-Board-Insulation/Owens-Corning/N-5yc1vZbaxxZ3q5"" target=""_blank"" style=""color:#F96302;"">Owens Corning Foam Board Insulation</a> styles</span></li><li class=""list__item""><span>Click here to learn more about <a href=""https://www.homedepot.com/c/ab/insulation-r-values/9ba683603be9fa5395fab9091a9131f"" target=""_blank"" style=""color:#F96302;"">Insulation R-Values</a></span></li><li class=""list__item""><a href=""https://www.homedepot.com/c/Return_Policy"" target=""_blank"" rel=""noopener noreferrer"" class=""product-overview__return-link"">Return Policy</a></li></ul></div>",29.58,8,48,in,1,4.41,lb,https://images.thdstatic.com/productImages/061ca435-fbff-49ac-9e0b-24bad4acc1fe/svn/owens-corning-foam-board-insulation-20we-64_600.jpg
