Product Category,Tags,Title,Handle,Body (HTML),Variant Price,Length,Width,Width Unit,Thickness,Variant Weight,Variant Weight Unit,Image Src
Building Materials,"""Ladders,Step Stools""",3-Step Steel Lightweight Step Stool Ladder 225 lbs. Load Capacity Type II Duty Rating (9ft. Reach Height),3-step-steel-lightweight-step-stool-ladder-225-lbs-load-capacity-type-ii-duty-rating-(9ft-reach-height),"Built for stability and convenience, the Gorilla Ladders 3-Step Lightweight Steel Ladder is an easily portable stool to make any job stress-free. It features a soft, comfort grip that offers a convenient place to grab while carrying the ladder and a locking step latch that keeps it in place. It boats extra-wide, platform steps that are slip-resistant for a safe climb. The ladder features an ANSI Type 2 Duty Rating (225 lbs. capacity) and a limited lifetime warranty.<div class=""grid bullet-list-wrapper""><ul class=""bullet-list bullet-list--margin list list--type-square""><li class=""list__item""><span>Lightweight design for easy portability</span></li><li class=""list__item""><span>Non-slip treads and feet</span></li><li class=""list__item""><span>Comfort grip</span></li><li class=""list__item""><span>Safe and easy to use</span></li><li class=""list__item""><span>Slim fold</span></li><li class=""list__item""><span>225 lbs. type II ANSI rating</span></li><li class=""list__item""><span>Limited lifetime warranty</span></li><span class=""list__item list__item--nopadding"" data-testid=""list-item-no-padding""></span><li class=""list__item""><a href=""https://www.homedepot.com/c/Return_Policy"" target=""_blank"" rel=""noopener noreferrer"" class=""product-overview__return-link"">Return Policy</a></li><li class=""list__item""><div class=""prop65-wrapper""><div class=""prop65-wrapper--flex""><div>California residents</div><div aria-expanded=""false""><button class=""list__link bttn-outline bttn--link"" id=""prop65__tooltip""><span class=""bttn__content"">see Prop 65 WARNINGS</span></button></div></div></div></li></ul></div>",39.88,undefined,17.5,in,undefined,14.1,lb,https://images.thdstatic.com/productImages/b444f634-e3d0-4666-a0a3-a681c89bb8dc/svn/gorilla-ladders-step-stools-gls-3-2-64_600.jpg
Building Materials,"""Scaffolding,Scaffolding Sets""","Safeclimb Baker Style Scaffold Rolling Platform, 1250 lbs. Load Capacity, 6 ft. W x 6.25 ft. H x 2.5 ft. D, Steel",safeclimb-baker-style-scaffold-rolling-platform-1250-lbs-load-capacity-6-ft-w-x-625-ft-h-x-25-ft-d-steel,"Your utmost safety is guaranteed when using the Safeclimb 6 ft. x 6.25 ft. x 2.5 ft. Steel Baker Style Scaffold Platform with Wheels, thanks to an anti-slip deck that has a climb-through opening and sturdy anti-slip rungs. Its heavy duty 5 inch caster wheels make it easy for rolling in any home project, such as painting drywall. It's adjustable to your preferred height at 2 in. increments and can allow the user to reach 12 ft high. The user can stack these Metaltech Bakers up to 3 units high to reach up to 24 ft. Its stable walk board has a load capacity of up to 1,250 lbs. Made from steel with yellow powder coated finish, this baker style scaffolding is intended for interior projects. This item is compatible with the Metaltech Climb-n-go which is a motor that you can add to your Metaltech Baker scaffold. Metaltech strives to develop, manufacture and sell safe, reliable, and innovative products that make working easier and faster to execute with built in safety and sturdiness. Our products are specifically suited for residential, commercial, and industrial construction.<div class=""grid bullet-list-wrapper""><ul class=""bullet-list bullet-list--margin list list--type-square""><li class=""list__item""><span>Safety and support are ensured with anti-slip rungs and anti-slip deck that even has a climb-through opening</span></li><li class=""list__item""><span>Made with rugged square steel tubes, topped off with a baked-on yellow poly powder coat finish</span></li><li class=""list__item""><span>Easy to roll and move around with its heavy duty 5 in. caster wheels</span></li><li class=""list__item""><span>Keep any tool or equipment close to you on the staging thanks to the 1,250 lbs. load capacity</span></li><li class=""list__item""><span>ANSI certified, OSHA compliant</span></li><span class=""list__item list__item--nopadding"" data-testid=""list-item-no-padding""></span><li class=""list__item""><a href=""https://www.homedepot.com/c/Return_Policy"" target=""_blank"" rel=""noopener noreferrer"" class=""product-overview__return-link"">Return Policy</a></li><li class=""list__item""><div class=""prop65-wrapper""><div class=""prop65-wrapper--flex""><div>California residents</div><div aria-expanded=""false""><button class=""list__link bttn-outline bttn--link"" id=""prop65__tooltip""><span class=""bttn__content"">see Prop 65 WARNINGS</span></button></div></div></div></li></ul></div>",298,5.6,74.75,in,undefined,127.6,lb,https://images.thdstatic.com/productImages/eaf02f00-eaf3-46c3-83c1-765edefa283e/svn/metaltech-scaffolding-sets-i-cisch1-64_600.jpg
Building Materials,"""Ceilings,Ceiling Tiles,Drop Ceiling Tiles""","2 ft. x 4 ft. Radar Basic White Square Edge Lay-In Ceiling Tile, case of 8 (64 sq. ft)",2-ft-x-4-ft-radar-basic-white-square-edge-lay-in-ceiling-tile-case-of-8-(64-sq-ft),"Quick and easy to install, these economical, all-purpose, lightly textured ceiling tiles feature a unique, non-directional pattern. USG Radar Basic Acoustical Ceiling Tiles are easy to clean and offer good sound absorption. Classified as low-emitting ceiling tiles, they are ideal for use in schools, corridors, lobby areas, offices, and retail stores.<div class=""grid bullet-list-wrapper""><ul class=""bullet-list bullet-list--margin list list--type-square""><li class=""list__item""><span>Economical, all-purpose ceiling tile</span></li><li class=""list__item""><span>Good sound control for a variety of commercial environments</span></li><li class=""list__item""><span>Wet-formed mineral fiber substrate</span></li><li class=""list__item""><span>Class A fire resistance</span></li><li class=""list__item""><span>GREENGUARD Gold certified for low-emitting performance</span></li><li class=""list__item""><span>USDA Certified Biobased Product</span></li><li class=""list__item""><span><a href=""https://www.homedepot.com/b/Building-Materials-Ceilings-Ceiling-Tiles/USG-Ceilings/N-5yc1vZc58lZ1ji"" target=""_blank"">Click here to shop more USG Ceiling Tiles</a></span></li><li class=""list__item""><a href=""https://www.homedepot.com/c/Return_Policy"" target=""_blank"" rel=""noopener noreferrer"" class=""product-overview__return-link"">Return Policy</a></li></ul></div>",undefined,47.75,23.75,in,0.625,44.16,lb,https://images.thdstatic.com/productImages/c196c30a-a23e-4631-9712-2ff657b99e87/svn/white-usg-ceilings-drop-ceiling-tiles-r2310-64_600.jpg
Building Materials,"""Concrete, Cement & Masonry,Asphalt Repair,Asphalt Crack Filler""",50 lb. Commercial Grade Blacktop Repair Patch,50-lb-commercial-grade-blacktop-repair-patch,"Quikrete 50 lb. Commercial Grade Permanent Blacktop Repair Patch is designed to repair potholes and cracks over 1 in. wide in asphalt pavements. Provides superior placement and bonding characteristics and produces a virtually permanent repair, even in cold, damp conditions.<div class=""grid bullet-list-wrapper""><ul class=""bullet-list bullet-list--margin list list--type-square""><li class=""list__item""><span>Use asphalt patch on roads, driveways, parking lots and pathways</span></li><li class=""list__item""><span>Repaired area is ready for immediate return to service</span></li><li class=""list__item""><span>Superior bond strength</span></li><li class=""list__item""><span>Use in wet or dry conditions</span></li><li class=""list__item""><span>Please be advised there could be a discrepancy regarding the pallet counts for certain Home Depot locations, if you are interested in purchasing pallet quantities, please reach out to your local Home Depot to confirm pallet counts.</span></li><li class=""list__item""><span>Note: product may vary by store</span></li><li class=""list__item""><a href=""https://www.homedepot.com/c/Return_Policy"" target=""_blank"" rel=""noopener noreferrer"" class=""product-overview__return-link"">Return Policy</a></li><li class=""list__item""><div class=""prop65-wrapper""><div class=""prop65-wrapper--flex""><div>California residents</div><div aria-expanded=""false""><button class=""list__link bttn-outline bttn--link"" id=""prop65__tooltip""><span class=""bttn__content"">see Prop 65 WARNINGS</span></button></div></div></div></li></ul></div>",15.77,9.5,undefined,undefined,undefined,50,lb,https://images.thdstatic.com/productImages/497443f0-b10c-4c1f-9f65-0c4e6e84b090/svn/quikrete-asphalt-crack-filler-170152-64_600.jpg
Building Materials,"""Siding,Wood Siding""",Plywood Siding Panel T1-11 8 IN OC (Nominal: 19/32 in. x 4 ft. x 8 ft. ; Actual: 0.563 in. x 48 in. x 96 in. ),plywood-siding-panel-t1-11-8-in-oc-(nominal-1932-in-x-4-ft-x-8-ft-actual-0563-in-x-48-in-x-96-in-),"Plywood siding is an all-wood exterior-grade panel. It is ideal for siding applications from new home construction, utility buildings, planters, dog houses and other remodeling or do-it-yourself-projects. Plywood siding features a rough-sawn textured face for a beautiful rustic appearance.<div class=""grid bullet-list-wrapper""><ul class=""bullet-list bullet-list--margin list list--type-square""><li class=""list__item""><span>Rich woodgrain texture of Southern yellow pine</span></li><li class=""list__item""><span>Attractive 8 in. groove pattern</span></li><li class=""list__item""><span>Easy to install with long-term durability</span></li><li class=""list__item""><span>Shiplapped 8 ft. edges for a seamless joint</span></li><li class=""list__item""><span>Can be painted or stained for a variety of exterior projects</span></li><li class=""list__item""><span>Recommended drain: K-7272 or K-7271</span></li><li class=""list__item""><span>Note: Product may vary by store</span></li><li class=""list__item""><a href=""https://www.homedepot.com/c/Return_Policy"" target=""_blank"" rel=""noopener noreferrer"" class=""product-overview__return-link"">Return Policy</a></li><li class=""list__item""><div class=""prop65-wrapper""><div class=""prop65-wrapper--flex""><div>California residents</div><div aria-expanded=""false""><button class=""list__link bttn-outline bttn--link"" id=""prop65__tooltip""><span class=""bttn__content"">see Prop 65 WARNINGS</span></button></div></div></div></li></ul></div>",41.96,95.938,47.938,in,0.563,3458,lb,https://images.thdstatic.com/productImages/2b6c0fe8-fc52-4986-99af-61b983b24a00/svn/unfinished-plytanium-wood-siding-113699-64_600.jpg
Building Materials,"""Drywall,Drywall Corner Bead""",1-1/4 in. x 8 ft. Quicksilver Metal Corner Bead,1-14-in-x-8-ft-quicksilver-metal-corner-bead,"QUICKSILVER corner bead is a hot-dipped, highly durable galvanized bead. QUICKSILVER corner bead provides a high-quality finish and solid protection at drywall corners. This traditional drywall finishing product is nailed, stapled, screwed or clinched into place. Flanges are deeply knurled and perforated for excellent joint compound adhesion.<div class=""grid bullet-list-wrapper""><ul class=""bullet-list bullet-list--margin list list--type-square""><li class=""list__item""><span>Offers superior corrosion protection</span></li><li class=""list__item""><span>Ideal for humid, moisture-prone conditions and high-traffic areas</span></li><li class=""list__item""><span>Strong metal reinforcement for drywall corners</span></li><li class=""list__item""><span>Exposed nose resists impact and forms a screed for finishing</span></li><li class=""list__item""><span>Note: product may vary by store</span></li><li class=""list__item""><a href=""https://www.homedepot.com/c/Return_Policy"" target=""_blank"" rel=""noopener noreferrer"" class=""product-overview__return-link"">Return Policy</a></li><li class=""list__item""><div class=""prop65-wrapper""><div class=""prop65-wrapper--flex""><div>California residents</div><div aria-expanded=""false""><button class=""list__link bttn-outline bttn--link"" id=""prop65__tooltip""><span class=""bttn__content"">see Prop 65 WARNINGS</span></button></div></div></div></li></ul></div>",4.76,8,1.25,in,undefined,1,lb,https://images.thdstatic.com/productImages/66e90a26-2907-4004-9b61-25da33a69e5d/svn/clarkdietrich-drywall-corner-bead-741339-64_600.jpg
Building Materials,"""Insulation,Fiberglass Insulation""",R- 19 Faced Fiberglass Insulation Roll 15 in. x 39.2 ft. (1 Roll),r-19-faced-fiberglass-insulation-roll-15-in-x-392-ft-(1-roll),"Owens Corning PINK Next Gen Fiberglas insulation installs faster because it's made like no other fiberglass insulation. PINK Next Gen fiberglass insulation rolls recover instantly, cut and split cleanly, glide in easily and stay put in the cavity, helping deliver inspection-ready results faster, they feel soft as cotton and are shed-resistant for more comfort and less cleanup on every job. And their advanced fiber technology creates a tightly woven network of soft, fine fibers to form a super-resilient blanket of insulating micro-pockets that deliver exceptional performance.<div class=""grid bullet-list-wrapper""><ul class=""bullet-list bullet-list--margin list list--type-square""><li class=""list__item""><span>Advanced fiber technology recovers without shaking or fluffing</span></li><li class=""list__item""><span>Creates less dust-less mess and faster clean up</span></li><li class=""list__item""><span>Safe, proven ingredients</span></li><li class=""list__item""><span>Cost-effective solution for a more comfortable home</span></li><li class=""list__item""><span>Absorbs noise for more peace and privacy</span></li><li class=""list__item""><span>Insulation offers sound proofing benefits by helping to reduce unwanted noise</span></li><li class=""list__item""><span>Green guard gold certified-contributes to indoor air quality</span></li><li class=""list__item""><span>Available with kraft or foil vapor barrier for moisture control</span></li><li class=""list__item""><span>Wood and metal framed wall, floor and ceiling assemblies</span></li><li class=""list__item""><span>Can be used in contact with concrete</span></li><li class=""list__item""><span>Cannot be left exposed-must be covered by a 15-minute thermal barrier</span></li><li class=""list__item""><span>PRO customers, the pallet size is 18 if applicable</span></li><li class=""list__item""><span>Can be combined with <a href=""in.https//www.homedepot.com/b/Building-Materials-Insulation-Foam-Board-Insulation/Owens-Corning/N-5yc1vZbaxxZ3q5"" in.="""" target=""in._blank"" style=""in.color#F96302;"">FORMULAR insulating sheathing</a> to achieve greater R-value in exterior wall applications</span></li><li class=""list__item""><span>Shop <a href=""in.https//www.homedepot.com/collection/Building-Materials/Owens-Corning-2x6-Wall-and-Floor-Insulation/Family-310386761"" in.="""" target=""in._blank"" style=""in.color#F96302;"">precut 2x6 wall and floor insulation </a> for faster installation</span></li><li class=""list__item""><span>Shop recommended <a href=""in.https//www.homedepot.com/collection/Building-Materials/Owens-Corning-Attic-Insulation/Family-310386762"" in.="""" target=""in._blank"" style=""in.color#F96302;"">products for insulating your attic</a></span></li><li class=""list__item""><span>Get everything you need to <a href=""in.https//www.homedepot.com/b/Featured-Products-Complete-Your-Drywall-Project/N-5yc1vZ2fkov39"" in.="""" target=""in._blank"" style=""in.color#F96302;"">complete your drywall project</a></span></li><li class=""list__item""><span>Click here to learn more about <a href=""in.https//ecooptions.homedepot.com/energy-efficiency/in."" target=""in._blank"" in.="""" style=""in.color#F96302;"">Eco Options and Energy Efficiency</a></span></li><li class=""list__item""><span>Click here to shop <a href=""in.https//www.homedepot.com/b/Building-Materials-Insulation-Fiberglass-Insulation/Owens-Corning/R19/N-5yc1vZbay7Z3q5Z1z18jv5"" in.="""" target=""in._blank"" style=""in.color"" #f96302;="""">Owens Corning R-19 Fiberglass Insulation</a> styles</span></li><li class=""list__item""><span>Click here to learn more about <a href=""in.https//www.homedepot.com/c/ab/insulation-r-values/9ba683603be9fa5395fab9091a9131f"" in.="""" target=""in._blank"" style=""in.color"" #f96302;="""">Insulation R-Values</a></span></li><li class=""list__item""><a href=""https://www.homedepot.com/c/Return_Policy"" target=""_blank"" rel=""noopener noreferrer"" class=""product-overview__return-link"">Return Policy</a></li><li class=""list__item""><div class=""prop65-wrapper""><div class=""prop65-wrapper--flex""><div>California residents</div><div aria-expanded=""false""><button class=""list__link bttn-outline bttn--link"" id=""prop65__tooltip""><span class=""bttn__content"">see Prop 65 WARNINGS</span></button></div></div></div></li></ul></div>",44.34,39.2,15,in,6.25,17.1,lb,https://images.thdstatic.com/productImages/425c55ca-107c-48d5-98f0-3587bc0433ca/svn/owens-corning-fiberglass-insulation-rf40-64_600.jpg
Building Materials,"""Insulation,Foam Board Insulation""",FOAMULAR NGX F-150 1 in. x 4 ft. x 8 ft. SSE R-5 XPS Rigid Foam Board Insulation,foamular-ngx-f-150-1-in-x-4-ft-x-8-ft-sse-r-5-xps-rigid-foam-board-insulation,"Owens Corning FOAMULAR NGX (Next Generation Extruded) insulation, is produced with a proprietary blowing agent that delivers a 90% reduction to Global Warming Potential (100 year) compared to current FOAMULAR. The new formulation and production process meets or exceeds new, more stringent regulatory standards without sacrificing product performance and offers a comprehensive line of products in a wide choice of sizes, thicknesses and edges with a Lifetime limited warranty for the life of the home or building. Foam insulation boards are easy to handle, score, cut and install &amp; no special tools are needed. Foam insulation products can be used on wood, steel framing or concrete walls. FOAMULAR NGX resists moisture and retains R-value even after exposure to standing water and wet soil. Owens Corning FOAMULAR NGX insulation offers all the physical properties and ease-of-use you expect from Owens Corning FOAMULAR insulation with industry-leading sustainability.<div class=""grid bullet-list-wrapper""><ul class=""bullet-list bullet-list--margin list list--type-square""><li class=""list__item""><span>Completely eliminates use of HFC 134a</span></li><li class=""list__item""><span>Manufactured with a blowing agent formulation that delivers a 90% reduction to global warming potential (100-year)1</span></li><li class=""list__item""><span>Excellent energy efficiency in the form of a high R-5 per inch</span></li><li class=""list__item""><span>Extremely low water absorption potential, delivering superior R-value retention in the presence of water</span></li><li class=""list__item""><span>Wide range of compressive strengths - up to 100 psi - to handle heavy loads</span></li><li class=""list__item""><span>Only XPS with a limited lifetime warranty that guarantees a minimum 90% of R-value for the life of the product</span></li><li class=""list__item""><span>FOAMULAR is not rated for STC (sound transmission) and does not have any soundproofing properties. <a href=""https://www.homedepot.com/b/Building-Materials-Insulation-Fiberglass-Insulation/Owens-Corning/N-5yc1vZbay7Z3q5"" target=""_blank"" style=""color:#F96302;"">Owens Corning fiberglass batts and rolls</a> are great options for acoustic applications.</span></li><li class=""list__item""><span>When using foamular or any low perm insulation, always verify the moisture vapor flow and dew point characteristics of the wall system, please check your local building codes for vapor retarder/barrier information</span></li><li class=""list__item""><span>Being used in an interior construction application, painting the fo is not recommended as foamular cannot be left exposed and will need to be covered by a 15-minute thermal barrier such as drywall</span></li><li class=""list__item""><span>If being used for crafts, acrylic or latex based paints can be used with foamular products</span></li><li class=""list__item""><span>If you're looking to insulate your garage door, <a href=""https://www.homedepot.com/p/Owens-Corning-Garage-Door-Fiberglass-Insulation-Kit-22-in-x-54-in-8-Panels-GD01/202257272"" target=""_blank"" style=""color:#F96302;"">Owens Corning Garage Door Insulation Kit</a> is an easy, fast and affordable way to keep your garage warm in winter and cool in the summer.</span></li><li class=""list__item""><span>If you're looking to ventilate your attic rafters, <a href=""https://www.homedepot.com/p/Owens-Corning-Raft-R-Mate-22-1-2-in-x-4-ft-Attic-Insulation-Rafter-Baffle-Proper-Vents-70-Pieces-70RM/204853491"" target=""_blank"" style=""color:#F96302;"">Owens Corning Raft-R-Mate</a> is a XPS foam vent designed to assure unrestricted airflow from the soffit to the ridge vent.</span></li><li class=""list__item""><span>FOAMULAR is available in 2 edge configurations</span></li><li class=""list__item""><span>Square Edge - designed to fit flush next to adjoining boards</span></li><li class=""list__item""><span>Scored Square Edge - comes with 3 factory scores, so that you can take a 4' sheet, break it in two and have two, 2' wide sheets (middle score), or you can break it into three 16"" wide pieces by snapping at the left and right score.</span></li><li class=""list__item""><span>Click here to shop <a href=""https://www.homedepot.com/b/Building-Materials-Insulation-Foam-Board-Insulation/Owens-Corning/N-5yc1vZbaxxZ3q5"" target=""_blank"" style=""color:#F96302;"">Owens Corning Foam Board Insulation</a> styles</span></li><li class=""list__item""><span>Click here to shop <a href=""https://www.homedepot.com/p/Loctite-PL-300-10-fl-oz-foamboard-adhesive-1421941/202020476"" target=""_blank"" style=""color:#F96302,"">loctite foamboard adhesive</a></span></li><li class=""list__item""><span>Click here to learn more about <a href=""https://www.homedepot.com/c/ab/insulation-r-values/9ba683603be9fa5395fab9091a9131f"" target=""_blank"" style=""color:#F96302;"">Insulation R-Values</a></span></li><li class=""list__item""><a href=""https://www.homedepot.com/c/Return_Policy"" target=""_blank"" rel=""noopener noreferrer"" class=""product-overview__return-link"">Return Policy</a></li></ul></div>",34.56,8,48,in,1,4.41,lb,https://images.thdstatic.com/productImages/d08a08d4-66bc-4c52-8739-8fd4bef7dc9a/svn/owens-corning-foam-board-insulation-20wengx-64_600.jpg
Building Materials,"""Drywall,Drywall Sheets""",5/8 in. x 4 ft. x 8 ft. EcoSmart Firecode X Drywall,58-in-x-4-ft-x-8-ft-ecosmart-firecode-x-drywall,"USG Sheetrock Brand EcoSmart Panels Firecode X are lightweight, fire-resistant gypsum panels that achieve the same strength and performance characteristics as standard 5/8 in. Sheetrock Brand Firecode X Panels at a lower environmental impact and reduced weight. They feature an innovative, noncombustible gypsum core encased in 100% recycled face and back papers. Long edges of the panels are tapered for easy finishing, allowing joints to be reinforced and concealed with Sheetrock Brand joint treatment systems. UL Classified for fire resistance, they can be used in any UL Design in which Type FC30 panels are listed. The UL Type Designation is printed on the face along the long edge of each panel for easy identification by building inspectors.<div class=""grid bullet-list-wrapper""><ul class=""bullet-list bullet-list--margin list list--type-square""><li class=""list__item""><span>Offers comparable sound, strength and sag resistance to standard 5/8 in. Type X</span></li><li class=""list__item""><span>Ideal for commercial or residential applications where 5/8 in. Type X panels are required, including load-bearing and nonload-bearing wood- or steel-framed fire-rated walls</span></li><li class=""list__item""><span>Comply with ASTM C1396, Standard Specification for Gypsum Board</span></li><li class=""list__item""><span>UL Classification as to fire resistance, surface-burning characteristics and noncombustibility</span></li><li class=""list__item""><span>Listed by UL in the most widely specified wall, column, floor- and roof-ceiling assemblies and horizontal membranes</span></li><li class=""list__item""><span>GREENGUARD Gold certified for low-emitting performance</span></li><li class=""list__item""><span>Meet Architecture 2030 Challenge for Products:  up to 25% less global warming potential; up to 30% less weight reduces transportation fuel energy by up to 20%</span></li><li class=""list__item""><span>Contain 100% USDA certified biobased content</span></li><li class=""list__item""><a href=""https://www.homedepot.com/c/Return_Policy"" target=""_blank"" rel=""noopener noreferrer"" class=""product-overview__return-link"">Return Policy</a></li></ul></div>",15.98,8,4,ft,undefined,57.6,lb,https://images.thdstatic.com/productImages/9e3d9b66-b50a-4548-8131-3636fae548df/svn/usg-sheetrock-brand-drywall-sheets-14116708-64_600.jpg
